Track,Paper_ID,Title,Authors,Institutions,Room,Poster_ID,Session,Abstract,Times,URL
Extended Abstract,150,"A Study of Domain Generalization on Ultrasound-based Multi-Class Segmentation of Arteries, Veins, Ligaments, and Nerves Using Transfer Learning","Edward Chen, Tejas S. Mathai, Vinit Sarode, Howie Choset, John Galeotti","Carnegie Mellon University, Carnegie Mellon University, Carnegie Mellon University, Carnegie Mellon University, Carnegie Mellon University",4,61,Afternoon,"Identifying landmarks in the femoral area is crucial for ultrasound (US) -based robot-guided catheter insertion, and their presentation varies when imaged with different scanners. As such, the performance of past deep learning-based approaches is also narrowly limited to the training data distribution; this can be circumvented by fine-tuning all or part of the model, yet the effects of fine-tuning are seldom discussed. In this work, we study the US-based segmentation of multiple classes through transfer learning by fine-tuning different contiguous blocks within the model, and evaluating on a gamut of US data from different scanners and settings. We propose a simple method for predicting generalization on unseen datasets and observe statistically significant differences between the fine-tuning methods while working towards domain generalization.","11:30am - 12:30pm ET, 5:15 - 6:15 pm ET",https://drive.google.com/open?id=1dytkB3TWgkIpdJSwwarej_68qXIdEhL1
Extended Abstract,178,Comparison of pharmacist evaluation of medication orders with predictions of a machine learning model,"Sophie-Camille Hogue, Flora Chen, Geneviève Brassard, Denis Lebel, Jean-François Bussières, Audrey Durand, Maxime Thibault","CHU Sainte-Justine; Université de Montréal, CHU Sainte-Justine; Université de Montréal, CHU Sainte-Justine; Université de Montréal, CHU Sainte-Justine; Université de Montréal, CHU Sainte-Justine; Université de Montréal, Mila; Université Laval, CHU Sainte-Justine; Université de Montréal",2,22,Morning,"The objective of this work was to assess the clinical performance of an unsupervised machine learning model aimed at identifying unusual medication orders and pharmacological profiles. We conducted a prospective study between April 2020 and August 2020 where 25 clinical pharmacists dichotomously (typical or atypical) rated 12,471 medication orders and 1,356 pharmacological profiles. Based on AUPR, performance was poor for orders, but satisfactory for profiles. Pharmacists considered the model a useful screening tool.",11:30am - 12:30pm ET,https://drive.google.com/open?id=1V4NVZLBKKhU48MneZaMCL2U0Vf_WrJts
Extended Abstract,180,Medical symptom recognition from patient text: An active learning approach for long-tailed multilabel distributions,"Ali Mottaghi, Prathusha K Sarma, Xavier Amatriain, Serena Yeung, Anitha Kannan","Stanford University, Curai, Curai, Stanford University, Curai",2,23,Morning,"We study the problem of medical symptoms recognition from patient text, for the purposes of gathering pertinent information from the patient (known as history-taking). We introduce an active learning method that leverages underlying structure of a continually refined, learned latent space to select the most informative examples to label. This enables the selection of the most informative examples that progressively increases the coverage on the universe of symptoms via the learned model, despite the long tail in data distribution.","11:30am - 12:30pm ET, 5:15 - 6:15 pm ET",https://drive.google.com/open?id=1PuRTPrf1ZjYlGwL1NBD0GhOvkcZLU8Ai
Extended Abstract,196,Forecasting Emergency Department Capacity Constraints for COVID Isolation Beds,"Erik Drysdale, Devin Singh, Anna Goldenberg",The Hospital for Sick Children,2,25,Morning,"Predicting patient volumes in a hospital setting is a well-studied application of time series forecasting. Existing tools usually make forecasts at the daily or weekly level to assist in planning for staffing requirements. Prompted by new COVID-related capacity constraints placed on our pediatric hospital's emergency department, we developed an hourly forecasting tool to make predictions over a 24 hour window. These forecasts would give our hospital sufficient time to be able to martial resources towards expanding capacity and augmenting staff (e.g. transforming wards or bringing in physicians on call). Using Gaussian Process Regressions (GPRs), we obtain strong performance for both point predictions (average R-squared: 82%) as well as classification accuracy when predicting the ordinal tiers of our hospital's capacity (average precision/recall: 82%/74%). Compared to traditional regression approaches, GPRs not only obtain consistently higher performance, but are also robust to the dataset shifts that have occurred throughout 2020. Hospital stakeholders are encouraged by the strength of our results, and we are currently working on moving our tool to a real-time setting with the goal of augmenting the capabilities of our healthcare workers. ",11:30am - 12:30pm ET,https://drive.google.com/open?id=1TNnfj7RoYbqFa4uh_Qv4oFO2veoXk5JI
Extended Abstract,202,Estimating County-Level COVID-19 Exponential Growth Rates: Estimating County-Level COVID-19 Exponential Growth Rates Using Generalized Random Forests,"Zhaowei She*, Zilong Wang*, Turgay Ayer, Asmae Toumi, Jagpreet Chhatwal","Georgia Institute of Technology, Georgia Institute of Technology, Georgia Institute of Technology, Massachusetts General Hospital, Massachusetts General Hospital; Harvard Medical School",4,64,Afternoon,"Rapid and accurate detection of community outbreaks is critical to address the threat of resurgent waves of COVID-19. A practical challenge in outbreak detection is balancing  accuracy vs. speed. In particular, while estimation accuracy improves with longer fitting windows, speed degrades. This paper presents a machine learning framework to balance this tradeoff using generalized random forests (GRF), and applies it to detect county level COVID-19 outbreaks. This algorithm chooses an adaptive fitting window size for each county based on relevant features affecting the disease spread, such as changes in social distancing policies. Experiment results show that our method outperforms any non-adaptive window size choices in 7-day ahead COVID-19 outbreak case number predictions.","11:30am - 12:30pm ET, 5:15 - 6:15 pm ET",https://drive.google.com/open?id=14p6KRZboBXCJpWGmQNilhJ45AWjDNHLY
Extended Abstract,214,Augmenting BERT Carefully with Underrepresented Linguistic Features,"Aparna Balagopalan, Jekaterina Novikova","Winterlight Labs; University of Toronto; Vector Institute, Winterlight Labs",4,66,Afternoon,"Fine-tuned Bidirectional Encoder Representations from Transformers (BERT)-based sequence classification models have proven to be effective for detecting Alzheimer's Disease (AD) from transcripts of human speech. However, previous research shows it is possible to improve BERT's performance on various tasks by augmenting the model with additional information. In this work, we use probing tasks as introspection techniques to identify linguistic information not well-represented in various layers of BERT, but important for the AD detection task. We supplement these linguistic features in which representations from BERT are found to be insufficient with hand-crafted features externally, and show that jointly fine-tuning BERT in combination with these features improves the performance of AD classification by upto 5\% over fine-tuned BERT alone. ","11:30am - 12:30pm ET, 5:15 - 6:15 pm ET",https://drive.google.com/open?id=1ztKya83UD7kxUC9OoMlW0TQKvcVsr6-J
Extended Abstract,224,A Bayesian Approach for Continual Learning in Clinical Time Series,"Yang Guo, Cheryl Wong Sze Yin, Savitha Ramasamy","Agency for Science Technology and Research (A*STAR) Singapore, Agency for Science Technology and Research (A*STAR) Singapore, Agency for Science Technology and Research (A*STAR) Singapore",2,27,Morning,"Clinical data is generated continuously, necessitating machine learning models to also adapt to the evolving data, without catastrophically forgetting the past. In this paper, we explore addressing the needs of such sequentially generated clinical data through continual learning. Specifically, we introduce a Continual learning Bayesian Long Short Term Memory (C-BLSTM), for learning a sequence of tasks. C-BLSTM includes architectural pruning through re-initializing redundant weights, regularization through variational inference, and memory replay through a coreset with class-balanced sampling. The C-BLSTM is demonstrated on two public healthcare data sets (MIMIC III and the PhysioNet Challenge 2012) for in-hospital mortality prediction. In these data sets, dynamic environments are simulated based on (i) ordinality of episodes, (ii) cardinality of patients and (iii) healthcare data site. The performance results show that the C-BLSTM, and hence continual learning, is effective in learning from a sequence of clinical time series.",11:30am - 12:30pm ET,https://drive.google.com/open?id=1U5nNy3QImN0GEQux0lmPDISwdQxOoqIA
Extended Abstract,268,MTB-HINE-BERT: a pre-trained genetic mutation representation model for predicting drug resistance of Mycobacterium tuberculosis,"Chenyang Wang, Yang Yang, Samaneh Kouchaki, A. Sarah Walker, Derrick W. Crook, Timothy E. A. Peto, David A. Clifton","Institute of Biomedical Engineering, Department of Engineering Science, University of Oxford; Institute of Biomedical Engineering, Department of Engineering Science, University of Oxford, Oxford-Suzhou Centre for Advanced Research; Department of Electrical and Electronic Engineering, University of Surrey; Nuffield Department of Medicine, University of Oxford; Nuffield Department of Medicine, University of Oxford; Nuffield Department of Medicine, University of Oxford; Institute of Biomedical Engineering, Department of Engineering Science, University of Oxford, Oxford-Suzhou Centre for Advanced Research",2,29,Morning,"Tuberculosis (TB) is one of the deadliest infectious diseases in the world, killing nearly 1.4 million people annually. WHO aims to end the global tuberculosis epidemics by 2035, but antibiotic-resistant TB is undermining this effort. With the development of whole-genome sequencing (WGS) technologies, machine learning models have gained significant interest in associating genetic mutations of pathogenic bacteria with their resistance/susceptibility to anti-TB drugs. Most of such studies only consider the presence or absence of genetic variations but ignore their biological contextual information. In this study, we propose MTB-HINE-BERT to predict drug resistance of TB bacteria. This framework includes (1) a Heterogeneous Information Network Embedding (HINE) model specially designed for integrating biological contextual information of genetic variants, and (2) a Bidirectional Encoder Representations from Transformers (BERT) without position embedding. The experiment results show that our model achieved the highest prediction accuracy compared with several advanced machine learning models.",11:30am - 12:30pm ET,https://drive.google.com/open?id=1R1xoFtfgj4xZdWT6A4wYwUqOvvLqqy24
Extended Abstract,275,Stable predictions for health related anticausal prediction tasks affected by selection biases: the need to deconfound the test set features,"Elias Chaibub Neto, Phil Snyder, Solveig K Sieberts, Larsson Omberg",Sage Bionetworks,2,30,Morning,"In health related machine learning applications, the training data often corresponds to a non-representative sample from the target populations where the learners will be deployed. In anticausal prediction tasks, selection biases often make the associations between confounders and the outcome variable unstable across different target environments. As a consequence, the predictions from confounded learners are often unstable, and might fail to generalize in shifted test environments. Stable prediction approaches aim to solve this problem by producing predictions that are stable across unknown test environments. These approaches, however, are sometimes applied to the training data alone with the hope that training an unconfounded model will be enough to generate stable predictions in shifted test sets. Here, we show that this is insufficient, and that improved stability can be achieved by deconfounding the test set features as well. We illustrate these observations using both synthetic data and real world data from a mobile health study.","11:30am - 12:30pm ET, 5:15 - 6:15 pm ET",https://drive.google.com/open?id=1XBmcZhula6DqXuuk8rRlAjntr37wGLAs
Extended Abstract,304,Model-Attentive Ensemble Learning for Sequence Modeling,"Victor D. Bourgin, Ioana Bica, Mihaela van der Schaar","University of Cambridge, University of Oxford; Alan Turing Institute, University of Cambridge; Alan Turing Institute; University of California Los Angeles (UCLA)",2,33,Morning,"Medical time-series datasets have unique characteristics that make prediction tasks challenging. Most notably, patient trajectories often contain longitudinal variations in their input-output relationships, generally referred to as temporal conditional shift. Designing sequence models capable of adapting to such time-varying distributions remains a prevailing problem. To address this we present the Model-Attentive Ensemble learning for Sequence modeling (MAES). MAES is a mixture of time-series experts which leverages an attention-based gating mechanism to specialize the experts on different sequence dynamics and adaptively weight their predictions. We demonstrate that MAES significantly out-performs popular sequence models on datasets subject to temporal shift.","11:30am - 12:30pm ET, 5:15 - 6:15 pm ET",https://drive.google.com/open?id=1smrKMnwGZUS1_QeF76tbjtPGwEGBsU9Z
Extended Abstract,307,Towards Automated Anamnesis Summarization: BERT-based Models for Symptom Extraction,"Anton Schäfer, Nils Blach, Oliver Rausch, Maximilian Warm, Nils Krüger","ETH Zurich, ETH Zurich, ETH Zurich, LMU Munich, LMU Munich",2,34,Morning,"Professionals in modern healthcare systems are increasingly burdened by documentation workloads. Documentation of the initial patient anamnesis is particularly relevant, forming the basis of successful further diagnostic measures. However, manually prepared notes are inherently unstructured and often incomplete. In this paper, we investigate the potential of modern NLP techniques to support doctors in this matter. We present a dataset of German patient monologues, and formulate a well-defined information extraction task under the constraints of real-world utility and practicality. In addition, we propose BERT-based models in order to solve said task. We can demonstrate promising performance of the models in both symptom identification and symptom attribute extraction, significantly outperforming simpler baselines.",11:30am - 12:30pm ET,https://drive.google.com/open?id=1Q3BByVc-04Q8KOYh1l9IXjkYDQiQ76H8
Extended Abstract,308,Towards Trainable Saliency Maps in Medical Imaging,"Mehak Aggarwal, Nishanth Arun, Sharut Gupta, Ashwin Vaswani, Bryan Chen, Matthew Li, Ken Chang, Jay Patel, Katherine Hoebel, Mishka Gidwani, Jayashree Kalpathy-Cramer, Praveer Singh","Athinoula A. Martinos Center for Biomedical Imaging, Massachusetts Institute of Technology",4,67,Afternoon,"While success of Deep Learning in automated diagnosis can be transformative to the medicinal practice especially for people with little or no access to doctors, its widespread acceptability is severely limited by inherent black-box decision making and unsafe failure modes. While saliency methods attempt to tackle this problem in non-medical contexts, their apriori explanations do not transfer well to medical usecases. With this study we validate a model design element agnostic to both architecture complexity and model task, and show how introducing this element gives an inherently self-explanatory model. We compare our results with state of the art non-trainable saliency maps on RSNA Pneumonia Dataset and demonstrate a much higher localization efficacy using our adopted technique. We also compare, with a fully supervised baseline and provide a reasonable alternative to it's high data labelling overhead. We further investigate the validity of our claims through qualitative evaluation from an expert reader.",5:15 - 6:15 pm ET,https://drive.google.com/open?id=1tcPulN5PZHVMuJudJU_KQfpjxhuMkFoT
Extended Abstract,362,Recommendations for Bayesian hierarchical model specifications for case-control studies in mental health,"Vincent Valton, Toby Wise, Oliver J. Robinson","Institute of Cognitive Neuroscience, University College London; Max Planck UCL Centre for Computational Psychiatry, University College London; Institute of Cognitive Neuroscience, University College London",2,35,Morning,"Hierarchical model fitting has become commonplace for case-control studies of cognition and behaviour in mental health. However, these techniques require us to formalise assumptions about the data-generating process at the group level, which may not be known. Specifically, researchers typically must choose whether to assume all subjects are drawn from a common population, or to model them as deriving from separate populations. These assumptions have profound implications for computational psychiatry, as they affect the resulting inference (latent parameter recovery) and may conflate or mask true group-level differences. 

To test these assumptions we ran systematic simulations on synthetic multi-group behavioural data from a commonly used multi-armed bandit task (reinforcement learning task). We then examined recovery of group differences in latent parameter space under the two commonly used generative modelling assumptions: (1) modelling groups under a common shared group-level prior (assuming all participants are generated from a common distribution, and are likely to share common characteristics); (2) modelling separate groups based on symptomatology or diagnostic labels, resulting in separate group-level priors. 

We evaluated the robustness of these approaches to variations in data quality and prior specifications on a variety of metrics. We found that fitting groups separately (assumptions 2), provided the most accurate and robust inference across all conditions. Our results suggest that when dealing with data from multiple clinical groups, researchers should analyse patient and control groups separately as it provides the most accurate and robust recovery of the parameters of interest.",11:30am - 12:30pm ET,https://drive.google.com/open?id=1oOk3IuSfBo4CmhEY9ONhRmBdAoJ5FSnd
Extended Abstract,377,transferGWAS: GWAS of Images Using Deep Transfer Learning,"Matthias Kirchler, Stefan Konigorski, Claudia Schurmann, Matthias Norden, Christian Meltendorf, Marius Kloft, Christoph Lippert","Hasso Plattner Institute; Technical University of Kaiserslautern, Hasso Plattner Institute, Hasso Plattner Institute, Hasso Plattner Institute; Charité – Universitätsmedizin Berlin, Beuth University of Applied Sciences, Technical University of Kaiserslautern, Hasso Plattner Institute",4,68,Afternoon,"Genome-wide association studies (GWAS) can uncover the genetic architecture of complex traits and diseases. So far, most approaches to GWAS on images are based on explicitly extracted phenotypes and discard important information. In this work, we present transferGWAS, a method that treats whole medical images as the phenotypes in a genome-wide association study. This allows transferGWAS to explore the genetics of complex traits more exhaustively. transferGWAS is complementary to traditional GWA studies and can be flexibly adapted to incorporate the investigator’s interests to focus on different aspects of the imaging modalities. We apply transferGWAS to retinal fundus images in the UK Biobank and show that it identifies both previously known and novel genetic loci.","11:30am - 12:30pm ET, 5:15 - 6:15 pm ET",https://drive.google.com/open?id=1wtyPsyAHf4-jAEJ3WXrWnroy5ayadV35
Extended Abstract,404,Generating SOAP Notes from Doctor-Patient Conversations,"Kundan Krishna, Sopan Khosla, Jeffrey Bigham, Zachary Lipton","Carnegie Mellon University, Carnegie Mellon University, Carnegie Mellon University, Carnegie Mellon University",4,70,Afternoon,"In this paper, we present the first study to generate full-length SOAP notes from conversations between physicians and patients, using summarization models. Despite the benefits of this documentation, their manual creation by physicians is onerous and time-consuming, and hence their automatic creation is useful. We cast their creation as a conversation summarization task decomposed into extractive and abstractive subtasks, and explore a spectrum of approaches according to how much they demand from each component. Our best performing method first (i) extracts noteworthy utterances via multi-label classification, assigning each to summary section(s); (ii) clusters noteworthy utterances on a per-section basis; and (iii) generates the summary sentences by conditioning on the corresponding cluster and the subsection of the SOAP sentence to be generated. Compared to an end-to-end approach that generates the full SOAP note from the full conversation, our approach improves by 8 ROUGE-1 points.","11:30am - 12:30pm ET, 5:15 - 6:15 pm ET",https://drive.google.com/open?id=1EltGjcai49rqZyFfUC8_Nld6hBgWaz1x
Extended Abstract,483,Opening a Can of Words: Train-test overlaps in Clinical Natural Language Processing Datasets,"Aparna Balagopalan, Tristan Naumann, Frank Rudzicz, Marzyeh Ghassemi","University of Toronto; Vector Institute, Microsoft Research, University of Toronto; Li Ka Shing Knowledge Institute;  Surgical Safety Technologies; Vector Institute, University of Toronto; Vector Institute",4,74,Afternoon,"Clinical natural language processing (NLP) has the potential to improve health care by leveraging unstructured data in patients' medical records. However, improved NLP model performance is reliant on robust data sources in both clinical and non-clinical settings. Recent work has shown that non-clinical NLP datasets contain substantial overlap between their training and test sets, leading to inflated reported performances. In this work, we analyze three benchmark clinical NLP datasets for natural language inference and entity recognition/normalization. We find significant train-test overlap in each dataset that is larger than similar general-domain datasets. For example, in the MedNLI dataset, 37\% of test set hypotheses appear in the training data, and we show that models perform dramatically worse in the absence of this overlap. Our findings demonstrate the importance of accounting for such train-test overlaps. ","11:30am - 12:30pm ET, 5:15 - 6:15 pm ET",https://drive.google.com/open?id=1M-YpxxRV9108kacraz3PQT3DWHXd_PHk
Extended Abstract,484,A stability-driven protocol for drug response interpretable prediction (staDRIP),"Xiao Li*, Tiffany M. Tang*, Xuewei Wang, Jean-Pierre A. Kocher, Bin Yu","UC Berkeley, UC Berkeley, Mayo Clinic, Mayo Clinic, UC Berkeley",4,75,Afternoon,"Modern cancer -omics and pharmacological data hold great promise in precision cancer medicine for developing individualized patient treatments. However, high heterogeneity and noise in such data pose challenges for predicting the response of cancer cell lines to therapeutic drugs accurately. As a result, arbitrary human judgment calls are rampant throughout the predictive modeling pipeline. In this work, we develop a transparent stability-driven pipeline for drug response interpretable predictions, or staDRIP, which builds upon the PCS framework for veridical data science (Yu and Kumbier, 2020) and mitigates the impact of human judgment calls.  Here we use the PCS framework for the first time in cancer research to extract proteins and genes that are important in predicting the drug responses and stable across appropriate data and model perturbations. Out of the 24 most stable proteins we identified using data from the Cancer Cell Line Encyclopedia (CCLE), 18 have been associated with the drug response or identified as a known or possible drug target in previous literature, demonstrating the utility of our stability-driven pipeline for knowledge discovery in cancer drug response prediction modeling.","11:30am - 12:30pm ET, 5:15 - 6:15 pm ET",https://drive.google.com/open?id=1FK19mchEGBbAJFThUna9gZ2xUB4-lU7q
Extended Abstract,488,Enhancing COVID-19 patient deterioration prediction using secondary task pre-trained embedding,"Itay Lieder, Nadav Amir, Ahuva Weiss-Meilik, Nathalie Bloch and Amitai Armon"," Intel IT Artificial Intelligence Group,  Intel IT Artificial Intelligence Group, Data Science and Quality Division Tel-Aviv Sourasky Medical Center, ARC Innovation Center Sheba Medical Center, Intel IT Artificial Intelligence Group",2,37,Morning,"We propose a method for addressing the problem of predicting deterioration of newly hospitalized COVID-19 patients, based on their electronic health records (EHRs). Our modeling framework can be used to predict the need for Intensive Care Unit (ICU) admission, mechanical ventilation, or mortality, and can help in determining the treatment for a specific patient, as well as in planning the hospital’s resources. Using EHRs from two large hospitals, we present a simple transfer-learning-based method that can address the data scarcity and imbalance by exploiting the underlying similarities between related tasks. This method utilizes the learning signal obtained from a related, secondary task, while preserving the contextual differences in the underlying measurements. We show that it significantly improves the prediction for deterioration in the next two weeks, based on the data available at the time of hospitalization.",11:30am - 12:30pm ET,https://drive.google.com/open?id=1W2inhTbjNGmLADlke7iVZ2SfywKvAluN
