Track,Paper_ID,Title,Authors,Institutions,Room,Poster_ID,Session,Abstract,Times,URL
Extended Abstract,512,Learning Optimal Predictive Checklists,"Haoran Zhang, Quaid Morris, Berk Ustun*, Marzyeh Ghassemi*","University of Toronto; Vector Institute, Memorial Sloan Kettering Cancer Center, University of California San Diego, University of Toronto; Vector Institute ",4,77,Afternoon,"Checklists are ubiquitous in medical applications. However, many checklists are constructed based on heuristics, and not learnt from real-world data. In this work, we present a method to learn optimal checklists from data. We model checklists as binary classifiers, and formulate checklist creation as an integer linear program. Our method allows practitioners to easily add operational constraints on performance and feature selection. We validate our method by learning checklists to predict in-hospital mortality from MIMIC-III. Our results show that our approach can fit simple customized checklists that perform well under a variety of constraints.","11:30am - 12:30pm ET, 5:15 - 6:15 pm ET",https://drive.google.com/open?id=1duYfCTzzOfT5XvqIhCU8eecH4zZP9VbU
Extended Abstract,562,Stratification of Systemic Lupus Erythematosus Patients with Gene Expression Data to Reveal Expression of Distinct Immune Pathways,Aditi A. Deokar,Boston University Academy,2,38,Morning,"Systemic lupus erythematosus (SLE) is the tenth leading cause of death in females 15-24 years old in the US. The diversity of symptoms and immune pathways expressed in SLE patients causes difficulties in treating SLE as well as in new clinical trials. This study used unsupervised learning on gene expression data from adult SLE patients to separate patients into clusters. The dimensionality of the gene expression data was reduced by three separate methods (PCA, UMAP, and a simple linear autoencoder) and the results from each of these methods were used to separate patients into six clusters with k-means clustering. The clusters revealed three separate immune pathways in the SLE patients that caused SLE. These pathways were: (1) high interferon levels, (2) high autoantibody levels, and (3) dysregulation of the mitochondrial apoptosis pathway. The first two pathways have been extensively studied in SLE. However, mitochondrial apoptosis has not been investigated before to the best of our knowledge as a standalone cause of SLE, independent of autoantibody production, indicating that mitochondrial proteins could lead to a new set of therapeutic targets for SLE in future research.",11:30am - 12:30pm ET,https://drive.google.com/open?id=1B-4-I4axFdHpHZgrpEBaAeDlADpK2wGd
Extended Abstract,581,A Time-Aware Transformer Based Model for Suicide Ideation Detection on Social Media,"Ramit Sawhney, Harshit Joshi, Saumya Gandhi, Rajiv Ratn Shah","IIIT Delhi, Delhi University, VNIT, IIIT Delhi",4,79,Afternoon,"Social media's ubiquity fosters a space for users to exhibit suicidal thoughts outside of traditional clinical settings. Understanding the build-up of such ideation is critical for the identification of at-risk users and suicide prevention. Suicide ideation is often linked to a history of mental depression. In this work, we focus on identifying suicidal intent in English tweets by augmenting linguistic models with historical emotional context. We propose STATENet, a time-aware transformer based model for preliminary screening of suicidal risk on social media. STATENet outperforms state-of-the-art methods, demonstrating the utility of emotional and temporal contextual cues for suicide risk assessment.","11:30am - 12:30pm ET, 5:15 - 6:15 pm ET",https://drive.google.com/open?id=1qfW-CYjmYoVa7IUBXPVsNxRFAI-5OIHQ
Extended Abstract,594,Phenotyping Clusters of Patient Trajectories suffering from Complex Disease,"Henrique Aguiar, Mauro D. Santos, Peter Watkinson, Tingting Zhu","IBME, Department of Engineering Science, University of Oxford; IBME, Department of Engineering Science, University of Oxford; CCRG, Kadoorie Centre, Nuffield Department of Clinical Neurosciences, University of Oxford; IBME, Department of Engineering Science, University of Oxford.",2,39,Morning,"Recent years have seen an increased focus
into the tasks of predicting hospital
inpatient risk of deterioration and trajectory
evolution due to the availability
of electronic patient data. A common
approach to these problems involves clustering
patients’ time-series information
(such as vital sign observations) to determine
dissimilar subgroups of the patient
population. Most clustering methods assume
time-invariance of vital-signs and
are unable to provide interpretability in
clusters that is clinically relevant, for
instance, event or outcome information.
In this work, we evaluate three different
clustering models on a large hospital
dataset of vital-sign observations from
patients suffering from Chronic Obstructive
Pulmonary Disease. We further propose
novel modifications to deal with
unevenly sampled time-series data and
unbalanced class distribution to improve
phenotype separation. Lastly, we discuss
further avenues of investigation for
models to learn patient subgroups with
distinct behaviour and phenotypes.",11:30am - 12:30pm ET,https://drive.google.com/open?id=1RgD1RoL_zEkbIEPcDG-qxmVjANYdztz9
Extended Abstract,602,Bayesian Recurrent State Space Model For rs-fMRI,"Arunesh Mittal, Scott Linderman, John Paisley, Paul Sajda","Columbia University, Stanford University, Columbia University, Columbia University",4,80,Afternoon,"We propose a hierarchical Bayesian recurrent state space model for modeling switching network connectivity in resting state fMRI data. Our model allows us to uncover shared network patterns across disease conditions. We evaluate our method on the ADNI2 dataset by inferring latent state patterns corresponding to altered neural circuits in individuals with Mild Cognitive Impairment (MCI). In addition to states shared across healthy and individuals with MCI, we discover latent states that are predominantly observed in individuals with MCI. Our model outperforms current state of the art deep learning method on ADNI2 dataset.","11:30am - 12:30pm ET, 5:15 - 6:15 pm ET",https://drive.google.com/open?id=1q0gEwPCXBwKsgGNCvqS82vm9gVmk3CT8
Extended Abstract,625,COVID-19 in Differential Diagnosis of Online Symptom Assessments,"Anitha Kannan,Richard Chen,Vignesh Venkataraman,Geoffrey Chen, Xavier Amatriain","Curai,Curai,Curai,Curai,curai",4,81,Afternoon,"The COVID-19 pandemic has magnified an already existing trend of people looking for answers to their healthcare concerns online. Symptom checkers are a common approach to provide an online assessment, but the use of rule-based systems introduces important limitations. This leads to COVID-19 symptom checkers not being able to provide a differential diagnosis. In this paper we present an approach that combines the strengths of traditional AI expert systems with novel deep learning models to leverage prior knowledge as well as any amount of existing data. We combine synthetic data generated from an expert system with real-world data coming from an online COVID-19 symptom checker to train a COVID-19 aware differential diagnosis deep learning model and show that our approach is able to accurately model new incoming data about COVID-19 while still preserving accuracy on other diagnosis. ","11:30am - 12:30pm ET, 5:15 - 6:15 pm ET",https://drive.google.com/open?id=1t2HVFgkoPqTK8M71OKch2W7Qg66xRhuE
Extended Abstract,664,Image analysis for Alzheimer's disease prediction: Embracing pathological hallmarks for model architecture design,"Sarah C. Brüningk*, Felix Hensel*, Catherine R. Juetzeler+, Bastian Rieck+","Department of Biosystems Science and Engineering ETH Zurich; SIB Swiss Institute of Bioinformatics,Department of Biosystems Science and Engineering ETH Zurich; SIB Swiss Institute of Bioinformatics,Department of Biosystems Science and Engineering ETH Zurich; SIB Swiss Institute of Bioinformatics, Department of Biosystems Science and Engineering ETH Zurich; SIB Swiss Institute of Bioinformatics",2,40,Morning,"Alzheimer's disease (AD) is associated with local (e.g. brain tissue atrophy) and global brain changes (loss of cerebral connectivity), which can be detected by high-resolution structural magnetic resonance imaging. Conventionally, these changes and their relation to AD are investigated independently. Here, we introduce a novel, highly-scalable approach that simultaneously captures local and global changes in the diseased brain. It is based on a neural network architecture that combines patch-based, high-resolution 3D-CNNs with global topological features, evaluating multi-scale brain tissue connectivity. Our local--global approach reached competitive results with an average precision score of 0.95+/-0.03 for the classification of cognitively normal subjects and AD patients (prevalence ~55%).",11:30am - 12:30pm ET,https://drive.google.com/open?id=1wseDOuUGRleAitAoGZ6j69xAIgqRVdBY
Extended Abstract,667,Deep Cox Mixtures for Survival Regression,"Chirag Nagpal, Steve Yadlowsky, Negar Rostamzadeh, Katherine Heller","Carnegie Mellon University; Google Brain, Google Brain, Google Brain, Google Brain",3,41,Morning,"Survival analysis is a challenging variation of regression modeling because of the presence of censoring, where the outcome measurement is only partially known, due to, for example, loss to follow up. Such problems come up frequently in medical applications, making survival analysis a key endeavor in biostatistics and machine learning for healthcare, with Cox regression models being amongst the most commonly employed models. We describe a new approach for survival analysis regression models, based on learning mixtures of Cox regressions to model individual survival distributions. We propose an approximation to the Expectation Maximization algorithm for this model that does hard assignments to mixture groups to make optimization efficient. In each group assignment, we fit the hazard ratios within each group using deep neural networks, and the baseline hazard for each mixture component non-parametrically.

We perform experiments on multiple real world datasets, and look at the mortality rates of patients across ethnicity and gender. We emphasize the importance of calibration, which is valuable for interpretability in healthcare settings and demonstrate that our approach outperforms classical and modern survival analysis baselines, both in terms of discriminative performance and calibration, with large gains in performance on the minority demographics.",11:30am - 12:30pm ET,https://drive.google.com/open?id=1EQcHiH1Sw0dZF8QJJEqbZ2m3C3-JYVFB
Extended Abstract,674,Uncertainty-Aware Multi-Modal Ensembling for Severity Prediction of Alzheimer’s Dementia,"Utkarsh Sarawgi, Wazeer Zulfikar, Rishab Khincha, Pattie Maes","Massachusetts Institute of Technology, Massachusetts Institute of Technology, Massachusetts Institute of Technology; BITS Pilani Goa Camps, Massachusetts Institute of Technology ",4,82,Afternoon,"Reliability in Neural Networks (NNs) is crucial in safety-critical applications like healthcare, and uncertainty estimation is a widely researched method to highlight the confidence of NNs in deployment. In this work, we propose an uncertainty-aware boosting technique for multi-modal ensembling to predict Alzheimer’s Dementia Severity. The propagation of uncertainty across acoustic, cognitive, and linguistic features produces an ensemble system robust to heteroscedasticity in the data. Weighing the different modalities based on the uncertainty estimates, we experiment on the benchmark ADReSS dataset, a subject-independent and balanced dataset, to show that our method outperforms the state-of-the-art methods while also reducing the overall entropy of the system. The source
code is available at https://github.com/wazeerzulfikar/alzheimers-dementia","11:30am - 12:30pm ET, 5:15 - 6:15 pm ET",https://drive.google.com/open?id=1AJQ7yjfiSisIaFyGx1HrM-zoibfIqh17