Track,Paper_ID,Title,Authors,Institutions,Room,Poster_ID,Session,Abstract,Times,URL
Extended Abstract,512,Learning Optimal Predictive Checklists,"Haoran Zhang, Quaid Morris, Berk Ustun*, Marzyeh Ghassemi*","University of Toronto; Vector Institute, Memorial Sloan Kettering Cancer Center, University of California San Diego, University of Toronto; Vector Institute ",4,77,Afternoon,"Checklists are ubiquitous in medical applications. However, many checklists are constructed based on heuristics, and not learnt from real-world data. In this work, we present a method to learn optimal checklists from data. We model checklists as binary classifiers, and formulate checklist creation as an integer linear program. Our method allows practitioners to easily add operational constraints on performance and feature selection. We validate our method by learning checklists to predict in-hospital mortality from MIMIC-III. Our results show that our approach can fit simple customized checklists that perform well under a variety of constraints.","11:30am - 12:30pm ET, 5:15 - 6:15 pm ET",https://drive.google.com/open?id=1duYfCTzzOfT5XvqIhCU8eecH4zZP9VbU
Extended Abstract,581,A Time-Aware Transformer Based Model for Suicide Ideation Detection on Social Media,"Ramit Sawhney, Harshit Joshi, Saumya Gandhi, Rajiv Ratn Shah","IIIT Delhi, Delhi University, VNIT, IIIT Delhi",4,79,Afternoon,"Social media's ubiquity fosters a space for users to exhibit suicidal thoughts outside of traditional clinical settings. Understanding the build-up of such ideation is critical for the identification of at-risk users and suicide prevention. Suicide ideation is often linked to a history of mental depression. In this work, we focus on identifying suicidal intent in English tweets by augmenting linguistic models with historical emotional context. We propose STATENet, a time-aware transformer based model for preliminary screening of suicidal risk on social media. STATENet outperforms state-of-the-art methods, demonstrating the utility of emotional and temporal contextual cues for suicide risk assessment.","11:30am - 12:30pm ET, 5:15 - 6:15 pm ET",https://drive.google.com/open?id=1qfW-CYjmYoVa7IUBXPVsNxRFAI-5OIHQ
Extended Abstract,602,Bayesian Recurrent State Space Model For rs-fMRI,"Arunesh Mittal, Scott Linderman, John Paisley, Paul Sajda","Columbia University, Stanford University, Columbia University, Columbia University",4,80,Afternoon,"We propose a hierarchical Bayesian recurrent state space model for modeling switching network connectivity in resting state fMRI data. Our model allows us to uncover shared network patterns across disease conditions. We evaluate our method on the ADNI2 dataset by inferring latent state patterns corresponding to altered neural circuits in individuals with Mild Cognitive Impairment (MCI). In addition to states shared across healthy and individuals with MCI, we discover latent states that are predominantly observed in individuals with MCI. Our model outperforms current state of the art deep learning method on ADNI2 dataset.","11:30am - 12:30pm ET, 5:15 - 6:15 pm ET",https://drive.google.com/open?id=1q0gEwPCXBwKsgGNCvqS82vm9gVmk3CT8
Extended Abstract,625,COVID-19 in Differential Diagnosis of Online Symptom Assessments,"Anitha Kannan,Richard Chen,Vignesh Venkataraman,Geoffrey Chen, Xavier Amatriain","Curai,Curai,Curai,Curai,curai",4,81,Afternoon,"The COVID-19 pandemic has magnified an already existing trend of people looking for answers to their healthcare concerns online. Symptom checkers are a common approach to provide an online assessment, but the use of rule-based systems introduces important limitations. This leads to COVID-19 symptom checkers not being able to provide a differential diagnosis. In this paper we present an approach that combines the strengths of traditional AI expert systems with novel deep learning models to leverage prior knowledge as well as any amount of existing data. We combine synthetic data generated from an expert system with real-world data coming from an online COVID-19 symptom checker to train a COVID-19 aware differential diagnosis deep learning model and show that our approach is able to accurately model new incoming data about COVID-19 while still preserving accuracy on other diagnosis. ","11:30am - 12:30pm ET, 5:15 - 6:15 pm ET",https://drive.google.com/open?id=1t2HVFgkoPqTK8M71OKch2W7Qg66xRhuE
Extended Abstract,674,Uncertainty-Aware Multi-Modal Ensembling for Severity Prediction of Alzheimer’s Dementia,"Utkarsh Sarawgi, Wazeer Zulfikar, Rishab Khincha, Pattie Maes","Massachusetts Institute of Technology, Massachusetts Institute of Technology, Massachusetts Institute of Technology; BITS Pilani Goa Camps, Massachusetts Institute of Technology ",4,82,Afternoon,"Reliability in Neural Networks (NNs) is crucial in safety-critical applications like healthcare, and uncertainty estimation is a widely researched method to highlight the confidence of NNs in deployment. In this work, we propose an uncertainty-aware boosting technique for multi-modal ensembling to predict Alzheimer’s Dementia Severity. The propagation of uncertainty across acoustic, cognitive, and linguistic features produces an ensemble system robust to heteroscedasticity in the data. Weighing the different modalities based on the uncertainty estimates, we experiment on the benchmark ADReSS dataset, a subject-independent and balanced dataset, to show that our method outperforms the state-of-the-art methods while also reducing the overall entropy of the system. The source
code is available at https://github.com/wazeerzulfikar/alzheimers-dementia","11:30am - 12:30pm ET, 5:15 - 6:15 pm ET",https://drive.google.com/open?id=1AJQ7yjfiSisIaFyGx1HrM-zoibfIqh17